verse,story
"There was an insolvent person without house or home, who remained in prison and pitiless bondage. He would unconscionably eat the rations of the prisoners; on account of (his) appetite he was (a burden) like Mount Qáf on the hearts of the people (in the gaol). No one had the pluck to eat a mouthful of bread, because that snatcher of portions would carry off his entire meal. Any one who is far from the feast of the Merciful (God) has the eye of a (low) beggar, though he be a sultan. He (the insolvent) had trodden virtue underfoot; the prison had become a hell on account of that robber of bread.",16
"If you flee in hope of some relief, on that side also a calamity comes to meet you. No corner is without wild beasts; there is no rest but in the place where you are alone with God. The corner (narrow cell) of this world's inevitable prison is not exempt from the charges for visitors and (the cost of) housewarming. By God, if you go into a mouse-hole, you will be afflicted by some one who has the claws of a cat. Man has fatness from (thrives on) fancy, if his fancies are beautiful;",16
"And if his fancies show anything unlovely he melts away as wax (is melted) by a fire. If amidst snakes and scorpions God keep you with the fancies of them that are (spiritually) fair, The snakes and scorpions will be friendly to you, because that fancy is the elixir which transmutes your copper (into gold). Patience is sweetened by fair fancy, since (in that case) the fancies of relief (from pain) have come before (the mind). That relief comes into the heart from faith: weakness of faith is despair and torment.",16
"Patience gains a crown from faith: where one hath no patience, he hath no faith. The Prophet said, “God has not given faith to any one in whose nature there is no patience.” That same one (who) in your eyes is like a snake is a picture (of beauty) in the eyes of another, Because in your eyes is the fancy of his being an infidel, while in the eyes of his friend is the fancy of his being a (true) believer; For both the effects (belief and unbelief) exist in this one person: now he is a fish and now a hook.",16
"Half of him is believer, half of him infidel; half of him cupidity, half of him patience (and abstinence). Your God has said, “(Some) of you (are) believing”; (and) again, “(Some) of you (are) unbelieving” (as) an old fire-worshipper. (He is) like an ox, his left half black, the other half white as the moon. Whoever sees the former half spurns (him); whoever sees the latter half seeks (after him). Joseph was like a beast of burden in the eyes of his brethren; at the same time in the eyes of a Jacob he was like a houri.",16
"Through evil fancy the (bodily) derivative eye and the original unseen eye (of the mind) regarded him (Joseph) as ugly. Know that the outward eye is the shadow of that (inward) eye: whatever that (inward) eye may see, this (outward) eye turns to that (eye). You are of where, (but) your origin is in Nowhere: shut up this shop and open that shop. Do not flee to the (world of the) six directions, because in directions there is the shashdara, and the shashdara is mate, mate.How the prisoners laid a complaint of the insolvent's high-handedness before the agent of the Cadi. The prisoners came to complain to the Cadi's agent, (who was) possessed of discernment,",17
"Saying, “Take now our salutations to the Cadi and relate (to him) the sufferings inflicted on us by this vile man; For he has remained in this prison continuously, and he is an idle gad-about, a lickspittle, and a nuisance. Like a fly, he impudently appears at every meal without invitation and without salaam. To him the food of sixty persons is nothing; he feigns himself deaf if you say to him, ‘Enough!’ No morsel reaches the (ordinary) man in prison, or if by means of a hundred contrivances he discover some food,",17
"That hell-throat at once comes forward (with) this (as) his argument, that God has said, ‘Eat ye.’ Justice, justice against such a three years' famine! May the shadow of our lord endure for ever! Either let this buffalo go from prison, or make him a regular allowance of food from a trust-fund. O thou by whom both males and females are (made) happy, do justice! Thy help is invoked and besought.” The courteous agent went to the Cadi and related the complaint to him point by point.",17
"The Cadi called him (the insolvent) from the prison into his presence, and (then) inquired (about him) from his own officers. All the complaints which that flock (of prisoners) had set forth were proved to the Cadi. The Cadi said (to him), “Get up and depart from this prison: go to the house which is your inherited property.” He replied, “My house and home consist in thy beneficence; as (in the case of) an infidel, thy prison is my Paradise. If thou wilt drive me from the prison and turn me out, verily I shall die of destitution and beggary.”",17
"(He pleaded) like the Devil, who was saying, “O Preserver, O my Lord, grant me a respite till the day of Resurrection; For I am happy (to be) in the prison of this world, in order that I may be slaying the children of mine enemy, (And), if any one have some food of faith and a single loaf as provision for the journey (to the life hereafter), I may seize it, now by plot and now by guile, so that in repentance they may raise an outcry (of lamentation); (And in order that) sometimes I may threaten them with poverty, sometimes bind their eyes with (the spell of) tress and mole.”",17
"In this prison (the world) the food of faith is scarce, and that which exists is in (danger of being caught in) the noose (of destruction) through the attack of this cur. (If) from prayer and fasting and a hundred helplessnesses (utter self-abnegations) the food of spiritual feeling come (to any one), he (the Devil) at once carries it off. I seek refuge with God from His Satan: we have perished, alas, through his overweening disobedience. He is (but) one cur, and he goes into thousands (of people): into whomsoever he goes, he (that person) becomes he (Satan). Whoever makes you cold (damps your spiritual ardour) know that he (Satan) is in him: the Devil has become hidden beneath his skin.",17
"When he finds no (bodily) form, he comes into (your) fancy, in order that that fancy may lead you into woe: Now the fancy of recreation, now of the shop; now the fancy of knowledge, and now of house and home. Beware! say at once “God help me!” again and again, not with tongue alone but from your very soul. The Cadi said, “Show plainly that you are insolvent.” “Here are the prisoners,” he replied, “as thy witnesses.” “They,” said the Cadi, “are suspect, because they are fleeing from you and weeping blood (on account of your ill-treatment of them);",17
"Also, they are suing to be delivered from you: by reason of this self-interest the testimony they give is worthless.” All the people belonging to the court of justice said, “We bear witness both to his insolvency and to his (moral) degeneracy.” Every one whom the Cadi questioned about his condition said, “My lord, wash thy hands of this insolvent.” The Cadi said, “March him round the city for all to see, (and cry), ‘This man is an insolvent and a great rogue.’ Make proclamations concerning him, street by street; beat the drum (as an advertisement) of his insolvency everywhere in open view.",17
"Let no one sell to him on credit, let no one lend him a farthing. Whosoever may bring here a claim against him for fraud, I will not put him in prison any more. His insolvency has been proven to me: he has nothing in his possession, (neither) money nor goods.” Man is in the prison of this world in order that peradventure his insolvency may be proven. Our God has also proclaimed in our Qur’án the insolvency of Iblís,",17
"Saying, “He is a swindler and insolvent and liar: do not make any partnership or (play any) game with him.” And if you do so (and) bring (vain) pretexts to him, he is insolvent: how will you get profit from him? When the trouble started, they brought on the scene the camel of a Kurd who sold firewood. The helpless Kurd made a great outcry; he also gladdened the officer (appointed to seize the camel) with (the gift of) a dáng; (But) they took away his camel from the time of forenoon until nightfall, and his lamentation was of no use.",17
"Upon the camel sat that sore famine (the insolvent), while the owner of the camel was running at its heels. They sped from quarter to quarter and from street to street, till the whole town knew him by sight. Before every bath and market-place all the people gazed on his (features and) figure. (There were) ten loud-voiced criers, Turks and Kurds and Anatolians and Arabs, (proclaiming), “This man is insolvent and has nothing: let no one lend him a single brass farthing;",17
"He does not possess a single mite, patent or latent: he is a bankrupt, a piece of falsehood, a cunning knave, an oil-bag. Beware and beware! Have no dealings with him; when he brings the ox (to sell), make fast the knot. And if ye bring this decayed fellow to judgement, I will not put a corpse in prison. He is fair-spoken and his throat is very wide; (he is clad) with a new inner garment (of plausibility) and a tattered outer garment. If he puts on that (inner) garment for the purpose of deceiving, it is borrowed in order that he may beguile the common folk.”",17
"Know, O simple man, that words of wisdom on the tongue of the unwise are (as) borrowed robes. Although a thief has put on a (fine) robe, how should he whose hand is cut off take your hand (lend you a helping hand)? When at nightfall he (the insolvent) came down from the camel, the Kurd said to him, “My abode is far (from here) and a long way off. You have ridden on my camel since early morning: I (will) let the barley go, (but I will not take) less than the cost of (some) straw.” “Why, then,” he rejoined, “have we been going round (the city) until now? Where are your wits? Is nobody at home?",17
"The (sound of the) drum (giving notice) of my insolvency reached the Seventh Heaven, and you have not heard the bad news! Your ear has been filled with foolish hope; (such) hope, then, makes (one) deaf (and) blind, my lad.” Even clods and stones heard this advertisement—“he is insolvent, he is insolvent, this scoundrel.” They (the criers) said it till nightfall, and it made no impression on the owner of the camel, because he was full of (idle) hope, full. God's seal lies upon the hearing and sight: within the veils is many a form and many a sound.",17
"He communicates to the eye that which He wills of beauty and of perfection and of amorous looks; And He communicates to the ear that which He wills of music and glad tidings and cries (of rapture). The world is full of remedies, but you have no remedy till God opens a window for you. Though you are unaware of that (remedy) just now, God will make it plain in the hour of need. The Prophet said that the glorious God has created a remedy for every pain;",17
"But of that remedy for your pain you will not see (even) the colour or scent without His command. Come, O you that seek the remedy, set your eye on non-spatiality, as the eye of one (about to be) killed (turns) towards the spirit. This (spatial) world has been produced from that which is without spatial relations, for the world has received (the relation of) place from placelessness. Turn back from existence towards non-existence, (if) you seek the Lord and belong to the Lord. This non-existence is the place of income: do not flee from it; this existence of more and less is the place of expenditure.",17
"Since God's workshop is non-existence, outside of the workshop there is (only) worthlessness. Put into our heart subtle words which may move Thee to mercy, O Gracious One! From Thee (come) both the prayer and the answer; from Thee safety, from Thee also dread. If we have spoken faultily, do Thou correct it: Thou art the Corrector, O Thou (who art the) Sultan of speech. Thou hast the alchemy whereby Thou mayst transmute it, and though it be a river of blood, mayst make it a Nile.",17
"Such alchemical operations are Thy work, such elixirs are Thy secrets. Thou didst beat water and earth together: from water and clay Thou didst mould the body of Adam. Thou gavest him (Man) lineage and wife and uncles, maternal and paternal, with a thousand thoughts and joys and griefs. Again, to some Thou hast given deliverance: Thou hast parted them from this grief and joy; Thou hast borne them away from kindred and relatives and (their own) nature, Thou hast made every fair thing foul in his (such a one's) eyes.",17
"He spurns all that is perceived by the senses, and leans for support on that which is invisible. His love is manifest and his Beloved is hidden: the Friend is outside (of the world), (but) His fascination is in the world. Give up this (belief). Loves (felt) for what is endued with form have not as their object the (outward) form or the lady's face. That which is the object of love is not the form, whether it be love for (the things of) this world or yonder world. That which you have come to love for its form—why have you abandoned it after the spirit has fled? ",17
"Its form is still there: whence (then) this satiety (disgust)? O lover, inquire who your beloved (really) is. If the beloved is that which the senses perceive, every one that has senses would be in love (with it). Inasmuch as constancy is increased by that (spiritual) love, how is constancy altered (impaired) by the (decay of the material) form? The sunbeam shone upon the wall: the wall received a borrowed splendour. Why set your heart on a piece of turf, O simple man? Seek out the source which shines perpetually.",17
"You who are in love with your intellect, deeming yourself superior to worshippers of form, That (intellect) is a beam of (Universal) Intellect (cast) on your sense-perception; regard it as borrowed gold on your copper. Beauty in humankind is like gilding; else, how did your sweetheart become (as ugly as) an old ass? She was like an angel, she became like a demon, for that loveliness in her was a borrowed (transient) thing. Little by little He (God) takes away that beauty: little by little the sapling withers.",17
"Go, recite (the text) to whom so We grant length of days, him We cause to decline. Seek the heart (spirit), set not thy heart on bones; For that beauty of the heart is the lasting beauty: its lips give to drink of the Water of Life. Truly it is both the water and the giver of drink and the drunken: all three become one when your talisman is shattered. That oneness you cannot know by reasoning. Do service (to God) and refrain from foolish gabble, O undiscerning man! Your reality is the form and that which is borrowed: you rejoice in what is relative and (secondary like) rhyme.",17
"Reality is that which seizes (enraptures) you and makes you independent of form. Reality is not that which makes blind and deaf and causes a man to be more in love with form. The portion of the blind is the fancy that increases pain; the share of the (spiritual) eye is these fancies (ideas) of dying to self (faná). The blind are a mine (full) of the letter of the Qur’án: they do not see the ass, and (only) cling to the pack-saddle. Since you have sight, go after the ass which has jumped (away from you): how long (will you persist in) stitching the saddle, O saddle-worshipper?",17
"When the ass is there, the saddle will certainly be yours: bread does not fail when you have the (vital) spirit. (On) the back of the ass is shop and wealth and gain; the pearl of your heart is the stock (which provides wealth) for a hundred bodies. Mount the ass bare-backed, O busybody: did not the Prophet ride the ass bare-backed? The Prophet rode (his beast) bare-backed; and the Prophet, it is said, journeyed on foot. The ass, your fleshly soul, has gone off; tie it to a peg. How long will it run away from work and burden, how long?",17
"It must bear the burden of patience and thanksgiving, whether for a hundred years or for thirty or twenty. None that is laden supported another's load; none reaped until he sowed something. ’Tis a raw (absurd) hope; eat not what is raw, O son: eating raw brings illness to men. (Do not say to yourself), “So-and-so suddenly found a treasure; I would like the same: neither work nor shop (for me)!” That (discovery of treasure) is Fortune's doing (a piece of luck), and moreover it is rare: one must earn a living so long as the body is able. ",17
"How does earning a livelihood prevent the (discovery of) treasure? Do not retire from work: that (treasure), indeed, is (following) behind (the work). See that you are not made captive by “if,” saying, “If I had done this or the other (thing),” For the sincere Prophet forbade (people) to say “if,” and said, “That is from hypocrisy”; For the hypocrite died in saying “if,” and from saying “if” he won nothing but remorse. Parable. A certain stranger was hastily seeking a house: a friend took him to a house in ruins.",17
"He said (to the stranger), “If this (house) had a roof, it would be a home for you beside me. Your family too would be comfortable, if it had another room in it.” “Yes,” said he, “it is nice (to be) beside friends, but my dear soul, one cannot lodge in ‘if’.” All the world are seekers of happiness, and on account of a false happiness they are in the fire. Old and young have become gold-seekers, but the common eye does not distinguish alloy from gold.",17
"The pure (gold) shot a beam on the alloy: see that you choose not the gold on the ground of (mere) opinion, without a touchstone. If you have a touchstone, choose; otherwise, go, devote yourself to him that knows (the difference). Either you must have a touchstone within your own soul, or if you know not the Way, do not go forward alone. The cry of the ghouls is the cry of an acquaintance—an acquaintance who would lure you to perdition. She (the ghoul) keeps on crying, “Hark, O caravan people! Come towards me, here is the track and the landmarks.”",17
"The ghoul mentions the name of each, saying “O so-and-so,” in order that she may make that personage one of those who sink. When he reaches the spot, he sees wolves and lions, his life lost, the road far off, and the day late. Prithee say, what is the ghoul's cry like? (It is) “I desire riches, I desire position and renown.” Prevent these voices from (entering) your heart, so that (spiritual) mysteries may be revealed. Repeat (in prayer) the name of God, drown the cry of the ghouls, close your narcissus eye to this vulture.",17
"Know the difference between the false dawn and the true, distinguish the colour of the wine from the colour of the cup, That, perchance, from the eyes which see the seven colours patience and waiting may produce a (spiritual) eye, (With which) you may behold colours other than these, and may behold pearls instead of stones. What pearl? Nay, you will become an ocean, you will become a sun traversing the sky. The Worker is hidden in the workshop: go you and in the workshop see Him plain.",17
"Inasmuch as the work has woven a veil over the Worker, you cannot see Him outside of that work. Since the workshop is the dwelling-place of the Worker, he that is outside is unaware of Him. Come, then, into the workshop, that is to say, non-existence, that you may see the work and the Worker together. As the workshop is the place of clairvoyance, then outside of the workshop there is (only) blindfold ness. The rebellious Pharaoh kept his face towards existence, consequently he was blind to His (God's) workshop.",17
"Consequently he was wishing to alter the (Divine) predestination, that he might turn back the (Divine) destiny from his door. Truly the (Divine) destiny every moment was laughing derisively under its lip at the moustache (arrogance) of that cunning plotter. He killed hundreds of thousands of innocent babes, in order that the ordainment and predestination of God might be averted. In order that the prophet Moses might not come forth, he laid on his neck (made himself responsible for) thousands of iniquities and murders. He wrought all that bloodshed, and (yet) Moses was born and was made ready for his chastisement.",17
"Had he seen the workshop of the Everlasting (God), he would have ceased to move hand or foot in plotting. Moses (lay) safe within his (Pharaoh's) house, while outside he was killing the infants in vain, Even as the sensual man who pampers his body and suspects some one else of a bitter hatred (against him), Saying, “This one is a foe, and that one is envious and an enemy,” (though) in truth his envier and enemy is that body (of his). He is like Pharaoh, and his body is his Moses: he keeps running (to and fro) outside, asking, “Where is my enemy?”",17
"His fleshly soul (is) luxuriating in the house, which is his body, (while) he gnaws his hand in rancour against some one else. How men blamed a person who killed his mother because he suspected her (of adultery). A certain man killed his mother in wrath, with blows of a dagger and also with blows of his fist. Some one said to him, “From evil nature you have not borne in mind what is due to motherhood. Hey, tell (me) why you killed your mother. What did she do? Pray, tell (me), O foul villain!” He said, “She did a deed that is a disgrace to her; I killed her because that earth (her grave) is her coverer (hides her shame).”",17
"The other said, “O honoured sir, kill that one (who was her partner in guilt).” “Then,” he replied, “I should kill a man every day. I killed her, I was saved from shedding the blood of a multitude: ’tis better that I cut her throat than the throats of (so many) people.” That mother of bad character, whose wickedness is in every quarter, is your fleshly soul. Come, kill it, for on account of that vile (creature) you are every moment assailing one who is venerable. Through it this fair world is narrow (distressful) to you, for its sake (you are at) war with God and man.",17
"(If) you have killed the fleshly soul, you are delivered from (the necessity of) excusing yourself: nobody in the world remains your enemy. If any one should raise a difficulty about my words in regard to the prophets and saints, (And should say), “Had not the prophets a killed (mortified) fleshly soul? Why, then, had they enemies and enviers?”— Give ear, O seeker of truth, and hear the answer to this difficulty (born) of doubt. Those unbelievers were (really) enemies to themselves: they were striking at themselves such blows (as they struck).",17
"An enemy is one who attempts (another's) life; he that is himself destroying his own life is not an enemy (to others). The little bat is not an enemy to the sun: it is an enemy to itself in the veil (of its own blindness). The glow of the sun kills it; how should the sun ever suffer annoyance from it? An enemy is one from whom torment proceeds, (one who) hinders the ruby from (receiving the rays of) the sun. All the infidels hinder themselves from (receiving) the rays of the prophets' (spiritual) jewel.",17
"How should (unbelieving) people veil the eyes of that peerless one (the prophet or saint)? The people have (only) blinded and distorted their own eyes. (They are) like the Indian slave who bears a grudge and kills himself to spite his master: He falls headlong from the roof of the house (in the hope) that he may have done some harm to his master. If the sick man become an enemy to the physician, or if the boy show hostility to the teacher, In truth they act as brigands against themselves: they themselves waylay their own mind and spirit.",17
"If a fuller take offence at the sun, if a fish is taking offence at the water, Just once consider whom that (anger) injures, and whose star is eclipsed by it in the end. If God create you with ugly features, take care lest you become both ugly-featured and ugly-natured; And if your shoes are ripped, do not go into stony ground; and if you have two spikes, don't become four-spiked. You are envious, saying, “I am inferior to so-and-so: he (by his superior position) is increasing my inferiority in fortune.”",17
"(But) indeed envy is another defect and fault; nay, it is worse than all inferiorities. That Devil (Satan), through the shame and disgrace of inferiority (to Adam), cast himself into a hundred damnations. Because of envy, he wished to be at the top. At the top, forsooth! Nay, (he wished) to be a blood-shedder. Abú Jahl was put to shame by Mohammed, and because of envy was raising himself to the top. His name was Abu ’l-Hakam, and he became Abú Jahl: oh, many a worthy has become unworthy because of envy.",17
"I have not seen in the world of search and seeking (trial and probation) any worthiness better than a good disposition. God made the prophets the medium (between Him and His creatures) in order that feelings of envy should be displayed in the agitation (produced by something that rankles in the mind). Inasmuch as no one was disgraced by (inferiority to) God, no one was (ever) envious of God; (But) the person whom he deemed like himself—he would bear envy against him for that reason. (Now), as the grandeur of the Prophet has become established, none feels envy (of him), since he is accepted (by all the Faithful);",17
